{
  "$schema": "http://json-schema.org/draft-06/schema",
  "type": "object",
  "properties": {
    "version": {
      "type": "number"
    },
    "success": {
      "type": "boolean"
    },
    "reason": {},
    "content": {
      "type": "object",
      "properties": {
        "rules": {
          "type": "array",
          "items": {
            "type": "object",
            "properties": {
              "id": {
                "type": "integer"
              },
              "identifier": {
                "type": "string"
              },
              "name": {
                "type": "string"
              },
              "mapping": {
                "type": "object",
                "properties": {
                  "Credential Access": {
                    "type": "object",
                    "properties": {
                      "confidence": {
                        "type": "string"
                      },
                      "user_override": {
                        "type": "boolean"
                      },
                      "enabled": {
                        "type": "boolean"
                      },
                      "ibm_default": {
                        "type": "boolean"
                      },
                      "id": {
                        "type": "string"
                      },
                      "techniques": {
                        "type": "object",
                        "properties": {
                          "Exploitation for Credential Access": {
                            "type": "object",
                            "properties": {
                              "confidence": {
                                "type": "string"
                              },
                              "enabled": {
                                "type": "boolean"
                              },
                              "id": {
                                "type": "string"
                              }
                            }
                          }
                        }
                      }
                    }
                  }
                }
              }
            }
          }
        }
      }
    },
    "raw": {},
    "inputs": {
      "type": "object",
      "properties": {
        "qradar_offense_id": {
          "type": "string"
        }
      }
    },
    "metrics": {
      "type": "object",
      "properties": {
        "version": {
          "type": "string"
        },
        "package": {
          "type": "string"
        },
        "package_version": {
          "type": "string"
        },
        "host": {
          "type": "string"
        },
        "execution_time_ms": {
          "type": "integer"
        },
        "timestamp": {
          "type": "string"
        }
      }
    }
  }
}